{
  "$schema": "./state.schema.json",
  "schema_version": "0.1.0",
  "project": {
    "name": "portable-opencode",
    "repository": "dpalazon-dev/portable-opencode",
    "phase": "definition",
    "status": "configuring",
    "scope": "personal-first",
    "primary_user": "repository-owner",
    "reuse_policy": "public-reuse-allowed-not-mvp-driver",
    "scope_decision": "DEC-014"
  },
  "environment": {
    "decision": "DEC-015",
    "primary_os": "windows-native",
    "wsl_required": false,
    "wsl_supported_in_mvp": false,
    "bootstrap_shell": "powershell",
    "primary_terminal": "windows-terminal",
    "posix_shell_scripts_required": false,
    "exact_windows_version": "pending-spike-001",
    "exact_powershell_version": "pending-spike-001",
    "private_state_schema": "schemas/environment-state.schema.json"
  },
  "managed_configuration": {
    "decision": "DEC-021",
    "design": "docs/design/MANAGED_CONFIGURATION_MATERIALIZATION.md",
    "resource_catalog_design": "docs/design/CANONICAL_RESOURCE_CATALOG.md",
    "environment_catalog": "config/resources/environment.jsonc",
    "project_catalog": "config/resources/project.jsonc",
    "resource_schema": "schemas/managed-resource.schema.json",
    "inventory_schema": "schemas/managed-resource-inventory.schema.json",
    "catalog_schema": "schemas/resource-catalog.schema.json",
    "default_modes": ["rendered", "copied"],
    "evidence_gated_mode": "linked",
    "external_state_mode": "queried",
    "local_only_mode": "private",
    "mutation_policy": "proven-ownership-only",
    "unknown_resource_policy": "preserve-and-report",
    "retirement_policy": "explicit-plan-no-broad-cleanup",
    "supported_version_manifest": "config/components.jsonc",
    "supported_version_schema": "schemas/supported-components.schema.json",
    "supported_versions_status": "pending-spike-evidence",
    "private_override_path": "%LOCALAPPDATA%\\portable-opencode\\override.jsonc",
    "private_override_default": "absent",
    "bootstrap_policy": "minimal-powershell-establish-cli-only"
  },
  "opencode": {
    "project_config_decision": "DEC-017",
    "superseded_project_config_decision": "DEC-016",
    "project_config_path": "opencode.jsonc",
    "project_asset_root": ".opencode",
    "root_agents_path": "AGENTS.md",
    "project_tui_config_path": "tui.jsonc",
    "project_tui_config_required": false,
    "root_json_policy": "migration-candidate",
    "dual_root_config_policy": "blocking-ambiguity",
    "misplaced_dot_opencode_config_policy": "report-unmanaged-misplaced-file",
    "runtime_override_provenance": [
      "OPENCODE_CONFIG",
      "OPENCODE_CONFIG_DIR",
      "OPENCODE_CONFIG_CONTENT",
      "%ProgramData%\\opencode"
    ],
    "runtime_validation": "pending-spike-001"
  },
  "openrouter": {
    "decision": "DEC-020",
    "design": "docs/design/OPENROUTER_PRESET_RECONCILIATION.md",
    "manifest_path": "config/openrouter/presets.jsonc",
    "schema": "schemas/openrouter-presets.schema.json",
    "managed_slugs": ["portable-main", "portable-reason", "portable-fast"],
    "reconciliation": "inspect-plan-explicit-apply-verify",
    "missing_policy": "create-after-approval",
    "drift_policy": "create-new-active-version-after-approval",
    "delete_policy": "never-automatic",
    "preset_reference_validation": "pending-spike-002",
    "concrete_manifest_status": "pending-spike-002-model-policy-evidence"
  },
  "agent_model_policy": {
    "decision": "DEC-018",
    "design": "docs/design/AGENT_AND_MODEL_ROLES.md",
    "native_primary_agents": ["build", "plan"],
    "native_subagents": ["general", "explore", "scout"],
    "custom_subagents": ["review", "verify"],
    "semantic_roles": ["main", "reason", "fast"],
    "mapping": {
      "build": "main",
      "plan": "reason",
      "review": "reason",
      "verify": "reason",
      "general": "fast",
      "explore": "fast",
      "scout": "fast",
      "small_model": "fast"
    }
  },
  "initialization": {
    "environment": "not_applicable",
    "scaffold": "dogfooded_manually",
    "interactive_context": "personal_first_alignment_complete",
    "project_verification_schema": "schemas/verification-manifest.schema.json",
    "ready": false
  },
  "context": {
    "path": "docs/context",
    "status": "active",
    "format": "repository-owned-okf-compatible-subset",
    "decision": "DEC-011",
    "design": "docs/design/CONTEXT_METADATA_SCHEMA.md",
    "schema": "schemas/context-document.schema.json",
    "required_frontmatter": ["type", "title", "description", "status"],
    "reserved_frontmatter_free": ["index.md", "log.md"],
    "deprecated_fields": ["created", "modified", "verified"],
    "migration_status": "complete",
    "migrated_files": [
      "docs/context/PROJECT.md",
      "docs/context/ARCHITECTURE.md",
      "docs/context/CONVENTIONS.md",
      "docs/context/OPERATIONS.md",
      "docs/context/DECISIONS.md",
      "docs/context/ROADMAP.md",
      "docs/context/index.md",
      "docs/context/log.md",
      "docs/design/CONFIGURATION_MATRIX.md",
      "docs/design/MANAGED_CONFIGURATION_MATERIALIZATION.md",
      "docs/design/AGENT_AND_MODEL_ROLES.md",
      "docs/design/GRAPHIFY_OUTPUT_POLICY.md",
      "docs/features/CONFIGURATION_TUI.md",
      "docs/research/CONFIGURATION_SURFACE_RESEARCH.md"
    ],
    "owner_verification": "approved-v0.3-scope-2026-09-09"
  },
  "scope_alignment": {
    "project": "aligned",
    "vision": "aligned",
    "architecture": "aligned",
    "conventions": "aligned",
    "operations": "aligned",
    "configuration_tui": "deferred",
    "roadmap": "codex-preflight-then-repository-gate-then-runtime-spikes",
    "configuration_matrix": "contracts-defined-owner-approved-pending-evidence",
    "managed_configuration_materialization": "aligned",
    "canonical_resource_catalog": "aligned",
    "cli_operation_contracts": "aligned",
    "evidence_mapping": "aligned",
    "codex_development_orchestration": "inconclusive-role-routing-not-structural",
    "spike_briefs": "spike-000-through-spike-004-defined",
    "repository_validation_ci": "implemented-local-validator-green-remote-ci-pending",
    "specification_v0_3": "draft-owner-approved-remote-ci-pending"
  },
  "architecture": {
    "model": "single-canonical-personal-workflow",
    "control_interface": "headless-cli-required",
    "tui": "deferred-until-cli-effective",
    "profile_strategy": "single-canonical-configuration",
    "environment_lifecycle": "separate-private-state",
    "project_lifecycle": "separate-versioned-state",
    "implementation_shape": "small-core-with-native-tool-surfaces",
    "resource_mutation_boundary": "proven-ownership-only"
  },
  "design": {
    "configuration_matrix": {
      "id": "DESIGN-001",
      "status": "contracts-defined-owner-approved-pending-evidence",
      "document": "docs/design/CONFIGURATION_MATRIX.md",
      "capability_count": 81,
      "previous_capability_count": 177,
      "remaining_personal_defaults": 0,
      "evidence_gated_decisions": ["DEC-009", "DEC-010", "DEC-012"],
      "completion_gate": "metadata_migrated_spec_synced_spikes_executed_evidence_resolved_owner_verified"
    },
    "agent_model_roles": {
      "id": "DESIGN-002",
      "status": "active_pending-runtime-validation",
      "document": "docs/design/AGENT_AND_MODEL_ROLES.md"
    },
    "graphify_output_policy": {
      "id": "DESIGN-003",
      "status": "active_pending-spike-004-validation",
      "document": "docs/design/GRAPHIFY_OUTPUT_POLICY.md"
    },
    "context_metadata_schema": {
      "id": "DESIGN-004",
      "status": "active-metadata-migrated-validator-green",
      "document": "docs/design/CONTEXT_METADATA_SCHEMA.md",
      "schema": "schemas/context-document.schema.json"
    },
    "observability_lifecycle": {
      "id": "DESIGN-005",
      "status": "proposed_pending-spike-003",
      "document": "docs/design/OBSERVABILITY_LIFECYCLE.md"
    },
    "openrouter_preset_reconciliation": {
      "id": "DESIGN-006",
      "status": "active_pending-spike-002-validation",
      "document": "docs/design/OPENROUTER_PRESET_RECONCILIATION.md",
      "schema": "schemas/openrouter-presets.schema.json"
    },
    "managed_configuration_materialization": {
      "id": "DESIGN-007",
      "status": "active_pending-windows-validation",
      "document": "docs/design/MANAGED_CONFIGURATION_MATERIALIZATION.md",
      "decision": "DEC-021"
    },
    "canonical_resource_catalog": {
      "id": "DESIGN-008",
      "status": "active_pending-spike-path-validation",
      "document": "docs/design/CANONICAL_RESOURCE_CATALOG.md"
    },
    "cli_operation_contracts": {
      "id": "DESIGN-009",
      "status": "active-preimplementation",
      "document": "docs/design/CLI_OPERATION_CONTRACTS.md",
      "result_schema": "schemas/operation-result.schema.json"
    },
    "evidence_and_spike_mapping": {
      "id": "DESIGN-010",
      "status": "active",
      "document": "docs/design/EVIDENCE_AND_SPIKE_MAPPING.md"
    },
    "powershell_script_inventory": {
      "id": "DESIGN-011",
      "status": "repository-validator-implemented-packaging-evidence-pending",
      "document": "docs/design/POWERSHELL_SCRIPT_INVENTORY.md"
    },
    "codex_development_orchestration": {
      "id": "DESIGN-012",
      "status": "active-inconclusive-role-routing",
      "document": "docs/design/CODEX_DEVELOPMENT_ORCHESTRATION.md",
      "work_package_schema": "schemas/codex-work-package.schema.json",
      "task_receipt_schema": "schemas/codex-task-receipt.schema.json"
    }
  },
  "features": {
    "configuration_tui": {
      "id": "FEAT-001",
      "status": "deferred",
      "decision": "DEC-013",
      "definition": "docs/features/CONFIGURATION_TUI.md",
      "technology_candidate": "ratatui",
      "implementation": "not_started",
      "reconsider_after": "effective-stable-cli"
    }
  },
  "spikes": {
    "codex_orchestration": {
      "id": "SPIKE-000",
      "status": "inconclusive",